{
  "appearance": {
    "emission": {
      "bake_glow_halo": false,
      "material_ids": [
        "MAT_EMISSION"
      ],
      "policy": "material_ids",
      "runtime_profile": "godot_cyan_0_0_85_1_energy_2_5_v1"
    },
    "maps_required": [
      "base_color",
      "normal",
      "orm",
      "emission_mask"
    ],
    "metallic": "mostly_metal",
    "notes": "Meshy supplies appearance only. Astrion owns geometry, UVs, material IDs and the binary emission mask. The 43.2% atlas occupancy is accepted for this experimental M3 proof because Asset Spec v0.1 has no occupancy threshold; M6 must define class-specific occupancy and padding policy.",
    "roughness": "medium",
    "rust": "none",
    "texture_resolutions": [
      1024,
      2048
    ],
    "wear": "light"
  },
  "geometry": {
    "allowed_origins": [
      "procedural_blender"
    ],
    "anchors": {
      "required": []
    },
    "components": {
      "max": 8,
      "min": 8,
      "required": [
        "Sphere_Core",
        "Plates_Band_Equator",
        "Plates_Band_Upper",
        "Plates_Cap_Upper",
        "Hub_Pole_Upper",
        "Core_Bezel_Outer",
        "Core_Rim_Inner",
        "Core_Lens"
      ]
    },
    "coordinate_profile": "astrion_blender_to_godot_v1",
    "flatness_range": null,
    "notes": "The repaired 4,166-triangle topology is authoritative. UV and texture stages preserve its exact geometry signature.",
    "preferred_origin": "procedural_blender",
    "primitive_rules": {
      "max_rotational_segments": 24
    },
    "soft_triangle_target": 4000,
    "triangle_ceiling": 5000
  },
  "identity": {
    "asset_id": "esfera-mecanica",
    "category": "prop_grande",
    "family": "mechanical",
    "notes": "M3 reference asset processed end-to-end; completion does not promote it to production.",
    "status": "experimental",
    "tier": "reference"
  },
  "notes": "This work-directory manifest is the completed M3 proof. It does not overwrite the original procedural or raw source assets.",
  "pipeline": {
    "audits": {
      "geometry": {
        "report": "astrion-3d-pipeline/work/esfera-mecanica-m4-run-v1/stages/02-audit1/geometry-audit-v0.1.json",
        "status": "waived",
        "waivers": [
          {
            "check_id": "never_visible_geometry",
            "expires": null,
            "reason": "The raised armor plates and core rings are intentionally closed semantic solids whose buried bases overlap Sphere_Core; deleting them would open the pieces or require a Boolean union that destroys the eight-component ownership contract.",
            "reviewer": "Repository owner, authorized in the Codex task on 2026-09-04",
            "revisit_condition": "Reopen if geometry/component topology, animation exposure, gameplay camera, declared screen size, or production status changes.",
            "scope": "Only the 25.5% never-visible ratio measured for the hash-bound 4,166-triangle esfera-mecanica repaired Master Mesh at top_down_default_v1 and 165.8 world units."
          }
        ]
      },
      "uv_textures": {
        "report": "astrion-3d-pipeline/work/esfera-mecanica-m4-run-v1/stages/05-audit2/uv-texture-audit-m3-v0.1.json",
        "status": "pass"
      }
    },
    "generated_inputs": [
      {
        "authority": "external_input",
        "notes": "Appearance only; never authoritative for geometry, UVs, material IDs or emission.",
        "path": "source/3d-models/crudo/esfera-mecanica-v2-meshy.glb",
        "role": "appearance_source"
      }
    ],
    "geometry_outcome": "repair",
    "master_mesh": {
      "exchange_path": "astrion-3d-pipeline/work/esfera-mecanica-m4-run-v1/stages/04-reproject/esfera-mecanica-v3-tex.glb",
      "source_path": "astrion-3d-pipeline/work/esfera-mecanica-m4-run-v1/stages/04-reproject/esfera-mecanica-v3-tex.blend",
      "status": "approved"
    },
    "notes": "M4 reproducible export. Godot verification remains a separate post-export gate.",
    "outputs": [
      {
        "authority": "derived",
        "path": "astrion-3d-pipeline/work/esfera-mecanica-m4-run-v1/stages/01-repair/repair-report.json",
        "role": "repair_evidence"
      },
      {
        "authority": "derived",
        "path": "astrion-3d-pipeline/work/esfera-mecanica-m4-run-v1/stages/02-audit1/geometry-audit-v0.1.json",
        "role": "geometry_audit_report"
      },
      {
        "authority": "derived",
        "path": "astrion-3d-pipeline/work/esfera-mecanica-m4-run-v1/stages/03-uv/esfera-mecanica-v2-uv.blend",
        "role": "authoritative_uv_material_source"
      },
      {
        "authority": "derived",
        "path": "astrion-3d-pipeline/work/esfera-mecanica-m4-run-v1/stages/03-uv/esfera-mecanica-v2-uv.glb",
        "role": "uv_material_exchange"
      },
      {
        "authority": "derived",
        "path": "astrion-3d-pipeline/work/esfera-mecanica-m4-run-v1/stages/04-reproject/emission-mask.png",
        "role": "deterministic_emission_mask"
      },
      {
        "authority": "derived",
        "path": "astrion-3d-pipeline/work/esfera-mecanica-m4-run-v1/stages/04-reproject/esfera-mecanica-v3-tex.blend",
        "role": "authoritative_textured_source"
      },
      {
        "authority": "derived",
        "path": "astrion-3d-pipeline/work/esfera-mecanica-m4-run-v1/stages/04-reproject/esfera-mecanica-v3-tex.glb",
        "role": "godot_ready_glb"
      },
      {
        "authority": "derived",
        "path": "astrion-3d-pipeline/work/esfera-mecanica-m4-run-v1/stages/05-audit2/uv-texture-audit-m3-v0.1.json",
        "role": "audit_2_report"
      }
    ],
    "provenance": {
      "base_spec": "esfera-mecanica",
      "blender_version": "5.2.1 LTS",
      "m4_run_manifest": "astrion-3d-pipeline/work/esfera-mecanica-m4-run-v1/run-manifest.json",
      "m4_runner": "astrion-m4-esfera-runner/0.1",
      "repair_report": "astrion-3d-pipeline/work/esfera-mecanica-m4-run-v1/stages/01-repair/repair-report.json",
      "source_asset_unchanged": true,
      "stage_output_isolation": true
    },
    "source_inputs": [
      {
        "authority": "astrion_source",
        "path": "tools/esfera-mecanica.py",
        "role": "procedural_builder"
      },
      {
        "authority": "astrion_source",
        "path": "tools/reparar-esfera-mecanica.py",
        "role": "deterministic_geometry_repair"
      },
      {
        "authority": "astrion_source",
        "path": "tools/esfera-mecanica-uv.py",
        "role": "authoritative_uv_material_emission_preparation"
      },
      {
        "authority": "astrion_source",
        "path": "tools/reproyectar-texturas.py",
        "role": "appearance_reprojection"
      },
      {
        "authority": "astrion_source",
        "path": "astrion-3d-pipeline/tools/audit_m3_esfera.py",
        "role": "m3_audit_2_recorder"
      },
      {
        "authority": "astrion_source",
        "path": "astrion-3d-pipeline/tools/run_m4_esfera.py",
        "role": "m4_local_runner"
      }
    ],
    "stage": "exported"
  },
  "schema_version": "0.1",
  "visual": {
    "camera_profile": "top_down_default_v1",
    "identity_features": [
      "staggered armor plate bands",
      "front lens and concentric rings"
    ],
    "major_masses": [
      "segmented spherical hull",
      "recessed concentric front core"
    ],
    "screen_size_world_units": 165.8,
    "silhouette_complexity": "low",
    "symmetry": {
      "order": 6,
      "type": "radial"
    }
  }
}
