{
  "schema_version": "0.1",
  "identity": {
    "asset_id": "esfera-mecanica",
    "category": "prop_grande",
    "family": "mechanical",
    "tier": "reference",
    "status": "experimental",
    "notes": "M3 reference asset processed end-to-end; completion does not promote it to production."
  },
  "visual": {
    "screen_size_world_units": 165.8,
    "camera_profile": "top_down_default_v1",
    "symmetry": {
      "type": "radial",
      "order": 6
    },
    "silhouette_complexity": "low",
    "major_masses": [
      "segmented spherical hull",
      "recessed concentric front core"
    ],
    "identity_features": [
      "staggered armor plate bands",
      "front lens and concentric rings"
    ]
  },
  "geometry": {
    "preferred_origin": "procedural_blender",
    "allowed_origins": [
      "procedural_blender"
    ],
    "soft_triangle_target": 4000,
    "triangle_ceiling": 5000,
    "coordinate_profile": "astrion_blender_to_godot_v1",
    "components": {
      "min": 8,
      "max": 8,
      "required": [
        "Sphere_Core",
        "Plates_Band_Equator",
        "Plates_Band_Upper",
        "Plates_Cap_Upper",
        "Hub_Pole_Upper",
        "Core_Bezel_Outer",
        "Core_Rim_Inner",
        "Core_Lens"
      ]
    },
    "primitive_rules": {
      "max_rotational_segments": 24
    },
    "flatness_range": null,
    "anchors": {
      "required": []
    },
    "notes": "The repaired 4,166-triangle topology is authoritative. UV and texture stages preserve its exact geometry signature."
  },
  "appearance": {
    "texture_resolutions": [
      1024,
      2048
    ],
    "maps_required": [
      "base_color",
      "normal",
      "orm",
      "emission_mask"
    ],
    "metallic": "mostly_metal",
    "roughness": "medium",
    "wear": "light",
    "rust": "none",
    "emission": {
      "policy": "material_ids",
      "material_ids": [
        "MAT_EMISSION"
      ],
      "runtime_profile": "godot_cyan_0_0_85_1_energy_2_5_v1",
      "bake_glow_halo": false
    },
    "notes": "Meshy supplies appearance only. Astrion owns geometry, UVs, material IDs and the binary emission mask. The 43.2% atlas occupancy is accepted for this experimental M3 proof because Asset Spec v0.1 has no occupancy threshold; M6 must define class-specific occupancy and padding policy."
  },
  "pipeline": {
    "stage": "godot_verified",
    "geometry_outcome": "repair",
    "source_inputs": [
      {
        "path": "tools/esfera-mecanica.py",
        "role": "procedural_builder",
        "authority": "astrion_source"
      },
      {
        "path": "tools/reparar-esfera-mecanica.py",
        "role": "deterministic_geometry_repair",
        "authority": "astrion_source"
      },
      {
        "path": "tools/esfera-mecanica-uv.py",
        "role": "authoritative_uv_material_emission_preparation",
        "authority": "astrion_source"
      },
      {
        "path": "tools/reproyectar-texturas.py",
        "role": "appearance_reprojection",
        "authority": "astrion_source"
      },
      {
        "path": "astrion-3d-pipeline/tools/audit_m3_esfera.py",
        "role": "m3_audit_2_recorder",
        "authority": "astrion_source"
      }
    ],
    "generated_inputs": [
      {
        "path": "source/3d-models/crudo/esfera-mecanica-v2-meshy.glb",
        "role": "appearance_source",
        "authority": "external_input",
        "notes": "Never authoritative for geometry, UVs, material structure or emission."
      }
    ],
    "master_mesh": {
      "status": "approved",
      "source_path": "astrion-3d-pipeline/work/esfera-mecanica-m3-v4/esfera-mecanica-v3-tex.blend",
      "exchange_path": "astrion-3d-pipeline/work/esfera-mecanica-m3-v4/esfera-mecanica-v3-tex.glb"
    },
    "outputs": [
      {
        "path": "astrion-3d-pipeline/work/esfera-mecanica-m3-v4/repair-report.json",
        "role": "repair_evidence",
        "authority": "derived"
      },
      {
        "path": "astrion-3d-pipeline/work/esfera-mecanica-m3-v4/esfera-mecanica-v2-uv.blend",
        "role": "authoritative_uv_material_source",
        "authority": "derived"
      },
      {
        "path": "astrion-3d-pipeline/work/esfera-mecanica-m3-v4/esfera-mecanica-v2-uv.glb",
        "role": "uv_material_exchange",
        "authority": "derived"
      },
      {
        "path": "astrion-3d-pipeline/work/esfera-mecanica-m3-v4/emission-mask.png",
        "role": "deterministic_emission_mask",
        "authority": "derived"
      },
      {
        "path": "astrion-3d-pipeline/work/esfera-mecanica-m3-v4/esfera-mecanica-v3-tex.blend",
        "role": "authoritative_textured_source",
        "authority": "derived"
      },
      {
        "path": "astrion-3d-pipeline/work/esfera-mecanica-m3-v4/esfera-mecanica-v3-tex.glb",
        "role": "godot_ready_glb",
        "authority": "derived"
      },
      {
        "path": "astrion-3d-pipeline/work/esfera-mecanica-m3-v4/uv-texture-audit-m3-v0.1.json",
        "role": "audit_2_report",
        "authority": "derived"
      },
      {
        "path": "astrion-3d-pipeline/work/esfera-mecanica-m3-v4/godot-smoke/godot-smoke-report.json",
        "role": "godot_import_evidence",
        "authority": "derived"
      }
    ],
    "audits": {
      "geometry": {
        "status": "waived",
        "report": "astrion-3d-pipeline/work/esfera-mecanica-repair-v3/geometry-audit-v0.1.json",
        "waivers": [
          {
            "check_id": "never_visible_geometry",
            "reason": "The raised armor plates and core rings are intentionally closed semantic solids whose buried bases overlap Sphere_Core; deleting them would open the pieces or require a Boolean union that destroys the eight-component ownership contract.",
            "scope": "Only the 25.5% never-visible ratio measured for the hash-bound 4,166-triangle esfera-mecanica repaired Master Mesh at top_down_default_v1 and 165.8 world units.",
            "reviewer": "Repository owner, authorized in the Codex task on 2026-09-04",
            "revisit_condition": "Reopen if geometry/component topology, animation exposure, gameplay camera, declared screen size, or production status changes.",
            "expires": null
          }
        ]
      },
      "uv_textures": {
        "status": "pass",
        "report": "astrion-3d-pipeline/work/esfera-mecanica-m3-v4/uv-texture-audit-m3-v0.1.json"
      }
    },
    "provenance": {
      "source_asset_unchanged": true,
      "geometry_master_before_uv": "astrion-3d-pipeline/work/esfera-mecanica-repair-v3/esfera-mecanica-repaired.blend",
      "asset_spec_audit_input": "astrion-3d-pipeline/work/esfera-mecanica-m3-v4/asset-spec-input.json",
      "blender_version": "5.2.1 LTS",
      "godot_version": "4.7.1-stable official",
      "uv_method": "SMART_PROJECT_TRIANGULATED plus deterministic isolation of two folded UV polygons",
      "appearance_correspondence": {
        "exact_triangle_twins": 4130,
        "bvh_triangles": 36,
        "max_bvh_distance": 0.0000685
      },
      "emission_runtime": {
        "color_srgb": [0.0, 0.85, 1.0, 1.0],
        "energy_multiplier": 2.5,
        "glow_halo_baked": false
      }
    },
    "notes": "M3 is complete for this experimental reference asset: Audit 1 is explicitly waived, Audit 2 passes, export is hash-recorded, and Godot import/runtime emission control passes in an isolated smoke project."
  },
  "notes": "This work-directory manifest is the completed M3 proof. It does not overwrite the original procedural or raw source assets."
}
